{
  "claim_id": "claim-payload-mismatch-001",
  "passport_id": "passport-2026-04-12-004",
  "nonce": "nonce-payload-001",
  "issued_at_utc": "2026-04-12T12:05:00.000Z",
  "expires_at_utc": "2026-04-12T12:20:00.000Z",
  "payload_hash": "0000000000000000000000000000000000000000000000000000000000000000",
  "authority_ref": "policy.ops.delete_export.approver.security",
  "claim_status": "ACTIVE",
  "single_use": true,
  "guard_version": "0.7.0-guard"
}
